{
  "title": "Don't push that door",
  "platform": "youtube-shorts",
  "format": "story-over-gameplay",
  "video_duration_sec": 32.0,
  "video_path": "",
  "audio_bed": "gameplay-sfx",
  "editor_notes": "Wallpaper is a solo queue push. The story is the mistake, not the gunfight. End card holds from 29s.",
  "shots": [
    {
      "id": "s01",
      "in_sec": 0.0,
      "out_sec": 2.4,
      "visual": "One player breaks a door. The three squad markers stay outside.",
      "on_screen_text": "",
      "cut_type": "hard",
      "energy": "hook",
      "note": "No name, no rank, no gun readable."
    },
    {
      "id": "s02",
      "in_sec": 2.4,
      "out_sec": 9.0,
      "visual": "Teammate ping sits on the door. He crosses the threshold anyway.",
      "on_screen_text": "",
      "cut_type": "hard",
      "energy": "build"
    },
    {
      "id": "s03",
      "in_sec": 9.0,
      "out_sec": 17.5,
      "visual": "Two icons on the ground ahead of him: a drop crate and the zone edge.",
      "on_screen_text": "",
      "cut_type": "hard",
      "energy": "build"
    },
    {
      "id": "s04",
      "in_sec": 17.5,
      "out_sec": 26.0,
      "visual": "A third squad icon appears on the stairs behind him as he is still inside.",
      "on_screen_text": "",
      "cut_type": "hard",
      "energy": "payoff",
      "note": "Leave the footstep sting dry. Do not cover it with a shout."
    },
    {
      "id": "s05",
      "in_sec": 26.0,
      "out_sec": 32.0,
      "visual": "Death cam, then a full-frame card.",
      "on_screen_text": "DON'T PUSH ALONE",
      "cut_type": "text-card",
      "energy": "payoff",
      "hold_for_read": true,
      "hold_in_sec": 29.0
    }
  ]
}
